Citation,DOI,Key findings,Effect size,Study basis,Year,Constraints,Study type,Geographic focus,Key words,pos/nev(0/1),year/posnev
"Mason, C.F., & Macdonald, S.M. (1987). ""The Use of Spraints for Surveying Otter (Lutra lutra) Populations: An Evaluation.""",10.1016/0006-3207(87)90100-5,Indirect mortality risks are inferred from habitat degradation and reduced spraint densities in polluted areas. Surveys provide valuable data for identifying high-risk areas.,Areas with lower spraint densities were associated with degraded riparian vegetation and poor water quality.,Habitat,1987,Mortality inferred through habitat assessments and spraint distribution patterns.,Observational Study,Europe,"Mortality, habitat degradation, spraints",0,2
"Guter, A., et al. (2008). ""Using Videotaping to Validate the Use of Spraints as an Index of Eurasian Otter (Lutra lutra) Activity.""",10.1016/j.ecolind.2007.04.009,Indirect mortality risks linked to habitat disturbance and reduced prey availability can be inferred through decreased spraint density at specific sites.,Spraint activity and otter visits were significantly lower in areas with higher human disturbance.,Habitat,2008,Mortality is indirectly inferred from activity patterns; no direct mortality data collected.,Observational Study,Israel,"Mortality, spraint activity, disturbance",0,4
"Britton, J.R., et al. (2017). ""Importance of Small Fishes and Invasive Crayfish in Otter (Lutra lutra) Diet in an English Chalk Stream.""",10.1051/kmae/2017004,No direct mortality data provided; potential impacts of invasive crayfish (Pacifastacus leniusculus) on prey competition and ecosystem balance noted.,"Crayfish contributed 6% to summer diets, indicating low abundance and potential for increasing influence.",Diet,2017,Mortality risks inferred from ecological impacts rather than direct evidence.,Spraint Analysis,UK,"Mortality, invasive species, prey availability",0,4
"Liles, G. (2003). ""Otter (Lutra lutra) Activity and Habitat Availability on the Pembrokeshire Coast and Milford Haven Waterway.""",Not available,"Road mortality and oil spills are major threats. Several otter road deaths were recorded near coastal areas, and historical oil spills have impacted habitats.",Observed roadkill near coastal habitats; oil spills noted as significant threats in nearby areas.,Habitat,2003,Mortality data relies on anecdotal and historical evidence; no systematic mortality analysis conducted.,Observational Study,UK,"Mortality, roadkill, oil spills",0,4
"Madsen, A.B., & Prang, A. (2001). ""Habitat Factors and the Presence or Absence of Otters (Lutra lutra) in Denmark.""",10.1007/BF03192516,"Mortality risks include traffic accidents and drowning in fish traps. PCB pollution historically impacted populations, but levels have since declined.",Traffic accidents and fish traps remain significant mortality risks despite mitigation measures.,Habitat,2001,"Mortality analysis relies on indirect data, including survey results and historical trends.",Observational Study,Denmark,"Mortality, PCB pollution, traffic accidents",0,4
"Kruuk, H. (1992). ""Scent Marking by Otters (Lutra lutra): Signaling the Use of Resources.""",10.1093/beheco/3.2.133,Indirect mortality risks are inferred from habitat competition and resource depletion in shared territories. Otters use spraints to minimize direct competition and potential conflicts.,No direct mortality data provided; indirect risks mitigated through spraint signaling.,Habitat,1992,"Mortality insights are inferred from behavioral data, not direct observations.",Observational Study,UK,"Mortality, resource competition, territoriality",0,2